title,published_date,content
on alcohol and my growth,2017-01-01 16:22:00,"It is 2017! New year same Chi. I have grown so much in 2017. New years is the measure of how much I have added to my person. I can basically join any group of guys and most groups of guys and girls and even a few groups of girls and get all of them to love me. I am exhausted at the end of every night and I did run out of things to say several times tonight. This makes me think that I am spending a lot of energy acting. When I say acting I mean being more than pretending to be someone else. I am being the lit version of Chi. It is exhausting. Once I am fully on which has only happened a few times this year, nothing can stop me. I did notice something. Some part of my body wants a relationship. I know I have written already that I want one but now it is really starting to show with my game and who I am choosing to be near. I end up kissing and loving on a girl like she is my girlfriend, instead of kissing her and fucking her like the one night stand that it is. That is how come I am having so much LMR at the end of the last few sets. I felt this wave of my evo coming back in new york and now I think it is finally here. I am trying so hard to be a boyfriend. In 2017, what do I want to do? I want to keep working out for sure. Get a nice routine going everyday. I can become someone else. I can fully od the nerd Chi bullshit in order to become the person I want to be. I really want to be a bartender abroad in budapest or paris or ibiza or some other crazy place. That or work at a hostel or just do any odd job for a few months as a break to the corporate grind that I am taking part in. In 2017, I will learn Russian. Gamewise, I don't know what else there is. 3some with 2 girls, higher than a 3some, 3 way kiss, fucking in a club, girls from different countries. These are all things to do but I'm just kinda over nightgame for now. I think from here on I will work way harder on my daygame. The quality of girls are better and it gives me way more of a high. Direct daygame is where Chi as we know him was created. I don't know what else to say. My brain is blank. budapest is lit. In 2017, I will become proficient in west coast swing. that's all for today."
the last wedding of the season,2018-10-21 20:00:00,"I was the best server. I was the most entertaining server person that people had ever interacted with. And it didn't even take that much energy. It was my normal shit. I loved that wedding. It definitely wasn't my best but it was in my top 3 from a dance move perspective and from a polarizing impact perspective. There were people there that absolutely loved me and there were others who probably didn't care too much for Chi, namely the girl who I told that I would have hated her when we were both 10. There's a lot that I could work on though. It was interesting bouncing the girl home that Saturday night juxtaposed with the game the way it is now. There is something about being in the presence of someone who is great and taking that energy with you. Generating it for yourself is one of the most difficult parts of the streets and even harder to teach. I went out with some guys last this Friday... 4 dudes from the inner circle chat and the first thing that I noticed is that they weren't approaching. One of the things that I wanted out of this was to be around people that were equal or more motivated to pull up than myself. I wanted that as a shortcut to generating that energy on my own to approach. There is still some part of my brain that wants that shortcut in will where I can just be near someone else and have them pull me up with them instead of how it literally always is where I'm having to pull everyone else up. If someone is to hang out with me, I have to grab them and carry them up the hill if I want them to participate on the level that I am at. On of the more annoying things about all that is that even by acting with intent and beauty, motherfuckers will still distill everything that you are doing down to looks or skin color or some other immutable characteristic that they don't have. Just tragic and also annoying. How can I teach or inspire when people are so low in their energy. I empathize with what the RSD guy told me over the phone during the sales call the other day. He said that RSDTyler has a lot of trouble empathizing with some of the guys that are at that super low level so he has coaches that teach and interact with most of the students, kids that are able to closer engage with that energy since in most circumstances, they were in that situation more recently. I empathize with that more after that recent experience and even now watching those dated Simple Pickup boot camp videos. It is uncomfortable watching this grown man approach these girls in Hollywood and fail so miserably. That being said, most of that would probably happen to me since I care way too much a lot of the time. There was a small period when I was in Baltimore, that shit I talk about all the time, where I truly believed everything that came out of my mouth and I could preach it and do it at the same time. I fully understood that the men that I was with would mostly not be able to engage on the level that I was engaging on and I was okay with that . We were all bad and figuring this shit out. I am now for some reason expecting myself to be good in the presence of such bad energy and that is not a reasonable expectation. There were certain things that I used to do that were inherently needy that were needed for me to excel in my bullshit. I needed to get over myself. I needed to destroy every excuse in my puny little brain that there was to not go talk to a girl. I pretended to be a waiter at a restaurant, I literally ran after bitches and surprised them to get a number close, I approached old Russian women on the inner harbor for the chance at something. absolute bullshit. But I showed regularly that there is never a reason to not go over somewhere. The next level? Coaching these men with the knowledge that I have to be the progenitor of information, I have to be the boss and I have to give direction or everyone will fail and stagnate. Yeah, dude it's time to grow up and actually be a leader. If you want to take that shit to the next level, you have to take charge."
what do you want,2022-10-14 03:51:00,"that reallly is the infinite question. I still don't really care all that much. I started this week out strong with the completion of a few sewing projects but that has faded this week.One reason is that there is less excitement to redo the things that I have already done. I like the novelty of doing something else, something new. The older things, even through I may be improving in them, don't give me much. I don't care.I'm going to really need to reset my dopamine levels... I don't know how that is possible with as much adventure and technology I have around me. Like even if I leave and get out in nature there is still a level of adventure to that activity that will put me into a place where I am in enjoyment. I really need to suffer boredom with no solution other than rote tasks that I can slightly improve on month by month. I don't know if I can or will ever or even want to ever banish myself to that level of the shadow realm. I want it but not really just like everything else in this life. Alas, i have responsibilities. Responsibilities truly are the only thing keeping me alive on any level at this point. I would just drift away to nothingness if these weren't a thing. I'm not sad. I'm just tired. always and forever tired lmao"
lol i think i like it,2025-01-29 08:20:00,"i like the bs with heri actually think i like it. it's fucked i know. i remember mary used to say this thing about my emotional rollercoaster. and it's a fucking ride. it's fucked but i like it. i get so riled up and righteous. i never get to be so correct against an immovable force. it's like fighting my childhood. it's fighting against every single thing that women exist as. it's arguing with the definition of interacting witha modern woman. and i think i love it. i caveat it bacause i don't konw for sure. but the evidence is there. even now, the energy is down and i want to talk to her again. i want to interact and hear her probalby say sorry and probably go back to doing the same shit that she was doing before which was recieving my adoration and time and effort and providing existence in return. how interesting. i wonder if i should do something about it. i wonder if this is a dynamic that i want to keep or something that i want ot work against and have a standard. in the end i will be alone. but the girl is caring and nice. she is smart and she does have porential. we cna dirve each other to the moon. but this shit about secrets man. this hyper unbalance in reciprocity is fucking agonizingly out of wack it's retarded. it's actually retarded and no healthy reasonable person would stand for it. but as healthy or reasonable a si might think that i am, i deeply deeply hate myself. and so in the end, i will tolerate anything because truly i don't deserve better."
where's chi,2015-08-20 04:57:00,"haha it seems like its that timer of the month again. the i\time when chi crashes and gives way to cheez and chibuzor. the time when the boss goes on vacation somewhere leaving the kids alone to fend for themselves literally this is a fucking trend. every few weeks Chi leaves. no one knows why. but here I will try to figure it out. I have realized that I have no clue how to prolong and sustain a relationship with a woman. Literally, have no idea. It's a weird and scary feeling seeing as I do want kids with a unicorn someday. Never have I ever taken a girl on more than 2-3 dates. Never have I ever had sex with a girl for more than 3 times. I don't know what to talk about after awhile. And to top it all off, if I act my normal self, chase the girl, and prove to her that I am special, then she will make me work for it (work for the pussy). I don't know how I feel about that. On the one hand, I welcome the challenge and see it as a sign of potential good girl inside. On the other hand, it's bullshit because other guys get in and out and never hear a sound. All these other dudes fuck and leave with out 2 thoughts but, if I ride in on my programmed stallion to save, I'm the one that has to wait. The good guy has to wait. So, now, as of some minutes ago, I am trying to get into the game of having women chase me. It's so oxymoronic to think that I still have to approach, stop them, and be a cool fun guy, while at the same time not trying and letting the girl chase me, while at the same time not revealing too much or any real information about myself, while at the same time being a boss. I don't know. There's so many frames and things to think about and do. I need to do consistent down talk and become a lot more nonreactive. But really, in the end, are all girls really this way? Yes. Yep. If I have learned nothing in these past few years, it's that all these girls are the same. LITERALLY IF AT ANY TIME THE THOUGHT goes through my head that, ""Hey this might be the one or this one might be different"", I need a firm slap to the face. I need to be plunged into the arctic sea and left for 20 minutes to reevaluate what just went through my mind with the experiences that have gotten me here. This game and girl shit really takes it out of me. Maybe I just need to recharge and do some daygame and chill for awhile. I need to practice this not letting the girl get to know me at all and letting my personality show instead of my resume. Show my personality not my resume. Also, I am going to go after Erica with everything. The next time I see her, I will talk to her and do what I should have done from the beginning of the year. but somehow leave it to her to pursue me??... yeah that's what I'll try to do. I need to find my chi again. (lol)"
a friend with a benefit,2017-10-13 16:50:00,"I am somehow still conversating with Cassidy. I feel dead about it though. Every time I take an action, I run it through my pre-frontal lobe processing unit which decides what the most likely reaction from her should be to my actions based on my current and past experiences and knowledge of her gender. The processing unit has been coming up with negative shit left and right. I don't know if it is a problem with the unit or if this sensor is an accurate reflection of the reality that I am creating. In my mind, it is only a matter of time before this thing dies. The processing unit predicts sooner than later e.g. in the next couple weeks. I have a friend with a benefit: we kissed a couple times. This is the setup for what Olivia did to me. This is the exact same pitch and I'm scared that it'll end in the exact same curve (lol see what I did there). I've retreated. I've reverted to plain Jane niceness. Anything further and I risk killing that benefit outright. Soon, I'm going to try to go and re-negotiate my contract to turn this into a full-fledged range of benefits. But with this shit, I am alone out on the ice. I don't know which way to go or what to do with this broad. All I know is is that I'm here and I'm feeling shit reminiscent of past heartaches. The difference is I'm grown now. No matter how much a grown and complain about this, I know how to handle it. I know how to bounce back. Good luck broski. Don't get too sucked in to this."
the hermit,2022-01-05 22:48:00,"I see who I'm becoming. It's interesting that at the time in my life when theoretically, I want to have the most human contact and the most amount of networking I am heavily resistant to online dating. Theoretically, it could be a relatively easy way to meet likeminded people, specifically women, and fraternize. The same with in person meetings. That said, every flake makes me lean away. I feel that I should just invest heavily in not doing this with people because I'm just not doing this with people. Normal people don't want to partake in activities like this. It just is what it is. It saddens me to see the world like this but it is what it is. I must push away from the dock, no wetsuit on my paddle board onto the lake in the dead of winter. It's cold but I will survive. I must survive."
"paris post 1: holy shit, I am abroad. this is a big fucking update",2016-12-22 13:38:00,"I have no idea what to talk about first. There is so much that I have thought about and done that to begin to describe and put my thoughts down on paper feels like tomfoolery. But here I am trying. Here we o. First, I keeps defaulting to a french accent to speak english. I think the reason is that once I introduce myself in french, bonjour, my brain has a hard time switching back to speaking english without the same mouth formation that I spoke the previous word. I also think that the parisiennes will understand more if I use their accent. French girls. Girls in Paris. Girls tonight. I want to title this blog post something different but I have not done enough. I have not gone out and experienced what all french girls are like. I have avoided daygame as much as possible as I do in the states. I am night game only and even then only certain nights. I was on by the end of the night but really I need to get used to getting rejected again. I think hanging out with Tom Keen will help because I don't want to disappoint him and his god style game. Alo, today I met Tom Keen. From the blacklist. At least a guy who looks just like him and speaks the same plus 4 languages and has the same master game. He was making out with a parisienne girl after 5 minutes of dancing. I was standing there thinking damn. I have done that before but somehow this guy is doing it nonchalantly. My game. These guys are operating on a different level than me they have internalized the rules of game. They understand, whether they know it or not, how to pump their own state and put the girl in it. They understand the idea of social capital and how it must be built in order to accomplish things with women. Most of these lessons I now realize are build in to us to understand. I am just so analytical that I still struggle. Even, I understand the concept but acting it out is now the struggle. I gave up and let him have the last girl of the night. Even though I opened her and found out the information that she needed a place to stay tonight. Why did I do that? My rationalizations are thus: 1) I want to make a permanent friend. I will not have someone to travel with so I really enjoy the comfort of feeling that I belong somewhere. I will stay on this for a minute. This is definitely a thing. I realize that in america, I feel too comfortable. I can walk around understanding everyone and doing things and feeling that same sense of belonging regardless of my actions. Here, in Paris, I have to take action to belong. If I want to sing I have to dance, sing, live, and breath and be in order to fit in. Who is Chi? I do not know what it means to be me anymore. Everyday I am confronted with things that I do and do not want to do at the same time. The things that I do not want to do I must do because they are good for me, make my life fun, and at the end, I will have appreciated that I did that thing. On the other hand, If I don't do something that I didn't want to do, I forget it and nothing in my life changes. End of thread. I don''t know where I was going with that. The other thing I want to talk before I go is being polarizing. I don't really want to go through the shit that i did in Paris but I will just because I feel the need. I will come back to the topic I need to cover. On the first day, I arrived and did nothing. I walked around my neighborhood, visited sacre-coeur the basilica, and went to the bar with hostel mates. I met some people along the way who's pictures I will post. The australian, Will. I talked with him until 4 in the morning of my first night in Paris. That was the first time I smoked a cigarette. I smoked more tonight. Is this a thing? No. I will try to keep this confined to Paris or just Europe but just Paris if I can make it be. I wanted him to feel like he belonged. I wanted to be his home away from home. I refuse to say no homo. But here it is inserted. On Wednesday, the roles have reversed and now I smoked with several of the guys from the bar. I did it to fit in not the other way around this time."
how to do philochkos business,2020-02-06 05:17:00,"the last question is payment - what is the breakdown of the pay that phil gets versus that that the model gets I think it's 20% and he could operate that way. once you have the youtube channel and the instagrams, you create a lot of content with the girl or she creates content alone. you post it to a youtube channel, patreon and instagram. maybe you create a website for all of this shit. work all of the leads from there. Let's say you keep all of the money from the main patreon but the side patreon, you only get 20%. you get more content by conducting photoshoots from your house and videos from your house. these don't have to be high quality. girls never have to get naked ass is what gets instagram followers. cheats like comment the letters of where you work and i'll follow are cool to get on explore pages or some shit. link to website or youtube channel in bio how to convince girls to do this shit for you - talk to them and show them the money i doubt he will divulge his secrets - i paid 50 to get his secrets and to talk about russia but fuck it, if i do get in then we gold and it'll be interesting. if not, fuck it, i tried. HOW TO ACTUALLY START start a youtube channel of twerking girls from instagram and convert over to girls from your real life - this way you will have funnels ready for girls who want to do the patreon thing"
death - i'm at 113. more real this time,2024-12-17 08:52:00,"i just can't get the engine started. i just keep starting and stopping, over an over and it's annoying. it's boring. it's tiring. i just almost don't want to participate. mary is right. i can't close. lol well she didn't say that. but it's in my body. closing is an absolute cunt."
reversing the downward spiral,2019-05-30 21:30:00,"Goddamn life has become an absolute shitshow ever since I got back from Russia. For difficulties at my job to insecurities rising again in my dating life, I have been struggling to stay afloat in one way or another for the past 5 months. Here we are, in the middle of 2019, with a business that kinda works but isn't profitable, no corporate job and thus no money to fund said business, a fear of women that seemingly came up out of no where (to the point where I'm afraid to go up to a whore in Tijuana and ask her to have sex with me for money which is a guarantee), and no real plans for the future. That is why I'm here. I need to stop the blood from flowing out of my life and into the ground and get this shit pumping again. I need to come up with a plan for the future that will reverse the destruction to my credit score that this business has done. I need a plan for improvement to get back on my path with the women and start loving this shit once again. I have half a mind to call up Jacob Fast and tell my man's I can't make it to his wedding... but that would be too much for me. I have failed two friends in this already and to drop the ball on the third would hurt me too much. I plan on going out alone tonight here in San Diego. I will go to the beach as soon as I get lifting and 'work' done and start speaking and go from there. Tomorrow I will go to LA and try my hand at the big leagues. Maybe I will stay an extra couple of days in order to spend time with my old friend Alex and my new friends Wilson and Charlie. Ironically enough, if I had made a serious attempt at technically mastering the cloud in those 4 weeks I had to prepare, I would be working with them directly right now. Alas, life and my own brain had different plans. 5/30 - San Diego 5/31 - Los Angeles 6/1 - Denver (If I can make the drive) From here I plan on driving across the country to go to my friend Jacob Fast's Wedding. This will be hard and gruelling. I don't want to do this but I know that it is a mini sacrifice I must make to perform the duty of friendship. I love this man and I wouldn't have made it through chemical engineering without him. I also had an amazing time with his wife at the Taylor Swift concert in Boston 2018 and I wouldn't trade those memories for anything. The level of freedom I was rockin' in those moments was amazing and I loved every minute. That said this will cost me an extra $20-60 in gas not to mention the food costs associated with chilling in that area for those extra days. I might chill and stay in Florida with Chad... If I choose to leave, I will go to Boston to see Britney Sanger which I have been promising since the beginning of May. It has been next to impossible to see this girl since I met her in my Boston trip earlier this year but she had good energy and seems very wholesome. I would love to meet up with her again and see where things go. New thought... I might drive directly to boston and fly from there to Florida, have Chad drive me around for a day, then fly back to start working and messing around. I might stay in Boston for a bit at this point. I have a lot of friends here and I could get a lot of content out with the rompers and probably generate a lot of sales in the RSD community and in the surrounding area. From here (if I leave Boston again) I will go to Baltimore to be with Evan and Jack. This will be fun and debaucherous and I have no doubt that the content will be mighty. I'm excited for this time because this may be semi defining. I will either stay here or go further on to Myrtle Beach. Myrtle Beach was my first love and it would be fitting that this would be the last place that I spend significant amounts of time before I leave this country that I love. This country that is home to my deepest insecurities, failures, successes, loves, hates, and everything in between. Myrtle Beach was my first vacation. Myrtle was one of the first times where I rustled together enough balls to approach girls though my friends didn't help (though nick ended up helping a shit ton). Then in august, I am supposed to go to fucking china (if this next interview goes well that is)! This will be the biggest life change I've had to this point... probably the most drastic other than deciding to take a whole year off to do internships.... which wasn't even a risk at the time. This is a change of careers, a change in cultures, a change in language, and a change in location. Let's get it."
