title,published_date,content
Girl Report - Hinge and the night out 8/21 Saturday,2019-09-23 06:21:00,"Man I have a lot of options. I am also broke. I can honeslbyly say that I wish that I was stuck in my bullshit job doing jack shit than here broke just waiting for the next move. This shit sucks. Being at the whim of the word. I try to keep as much control as possible but this is hard. This life situation has forced me to live on the bright side more than ever. I gave in to the darkness within for a few weeks there and went a really really bad place. I don’t know, I just thought it would feel good to be ‘realistic’ or own up to my issues. While I think it is good to look at life as reasonably as possible and to not add any sort of veneer to what is going on, I also think that you get to choose your truth and how to orient yourself on a daily basis. Whatever I speak into existence is real and the more often that I let negativity and the feeling surrounding these circumstances affect me or stick around, the worse off that I will be. Any way, on to the life report. The night out started similar to other nights out. Slow. I was bouncing at the Bank again. There were some sets when I entered but not many. I started by talking to a girl that I have initiated things with the past night owork. I tried to make her chase through several teasers about her dance moves and disqualifies around those dance moves as well as the size of her butt etc. These were working like a charm and she was hanging off mom my arm for that portion of the night. This was about 30 or so minutes. Then she started doing drugs and associating with drug dealers and I fell off her radar over the night. Oh well, moving on. The best part of the night was these group of three girls. They looked so nice and innocent and I could tell that they did not go to places like this often. At that moment, I was speaking to my old and literally old friend Eric the old pimp of morgantown and I was telling him that I was going to have to leave him to pull up on these girls since they looked os innocent but also as a result about to leave. He nodded and I did a round then dove in. I rolled in there with that innocent observation and the girls reacted loudly in my favor. Basically everything I said or did thereafter got a huge reaction from them It was like being a comedian and every joke you hit just kills. I moved from that to get information from them Two of the girls in the group were cute and the third was a big fat black girl whom I mostly ignored, perhaps to my detriment. We’ll never know. I asked question like what music did they actually listen to, where were they from, and how much alcohol did they have to drink. They responded positively like I said and I moved to say,”don’t leave without getting my insta because you all are so fun and I want to hang out with you.” They agreed and I went on another round. No clue why I didn’t just close them there and then. As a bouncer there’s not a hing chance that the Gil is actually going to stick around that specific club all night. Most girls do a lot of club hopping so if you end up talking to someone the best policy is to get their information and start contact with them immediately so that you know who they are the entire night. Maybe you can meet up with them later but if you don’t get their contact in the moment, you will likely lose them. And that is what happened here. I turned my back and the girls had disappeared. Boo that sucks. Next there was a tall brunette girl that really liked m y day e moves and kept trying to dance with me. I saw how hot her friends were and I saw the dynamic of their interaction so when this girl approached me, I led with a lot of push pull. On her initial approach I danced with her a bit, told her I loved her and asked for her name. I let her go. On her second approach, Teach Me How to Dougie was playing and she was trying to Dougie. I was terrible. So I approached her and gave her shit for her terrible Dougie. This caused her to try harder and for her friends to laugh a bit. I tried to teach her demonstrating that I was in fact a good dancer. She could not learn at all. I grabbed her and brought her in close and told her to stick to her strengths. She had a decent butt and was very fun so she should stick to Cardi B and Beyonce songs. She laughed and agreed and I said that I would be testing her later on that music. I left her again. She approached a third time and grabbed my arm and started dancing on me. I laughed and literally pushed her off of me. I think that was the last interaction we had before she left the bar with out my knowledge. Unfortunate. Too much push without any closing or vibing. Bad game. Do better next time. Next, there were two girls that were sitting at a table and were clearly interested in speaking to me. They had been staring for most of the night. But for some goddamn reason I just played with their attention, getting close but talking to one of my guy friends that was standing nearby, looking in their direction and almost making eye contact before turning away. I don’t know why I was on this type of shit. It didn’t work obv and they ended up losing interest and fraternizing with other guys and people for the rest of the night. This was dumb since they stayed the longest and I probably could have been interacting with them a lot longer and through out the night if I would have made that approach when I should have... at the beginning of the night. The last thing of note was the the owner of the bar got in an argument with a girl and her mom and asked me to remove them immediately. I had to manhandle the girl to get her out of the bar. It wasn’t pretty. I should look up better techniques on how to remove people from the bar because that was ridiculous. There were many sets throughout the night that I didn’t approach. I could about 5 or 6 very attractive sets that I could have had good interactions with. I was stopped by fear in 2 cases... the very hot blonde that reminded me of Hannah g in that the was too pretty to really do anything or dance on the dance floor. A very boring girl but very cute. And then there were two bombshells that walked in... one with lipstick and a skirt and idk about the other. And the rest, I was stopped by may own blaze apathy towards women. I don’t really know what this mood is but it is just a lack of caring whether or not I interact positively or negatively with any group of girls. This version doesn’t want to stir the pot or step out of line to be potentially rebuked by the women or the bosses. I think part of this came out when Omar (one of the bar owners) yelled at me for dancing when there were allegedly people smoking in the bar. That shit kinda broke me. I have been trying to get to a solid place where I feel comfortable vining but I honestly have a bit of fear around that happening again. And then there are the hinge girls... but that shall be a story for another day. Good night."
order is a weakness,2017-09-13 19:30:00,"I need to have everything in my life in a specific way to I get anxious and refuse to move on. I missed a flight that was paid for by Epic today. I just had to have my new iPhone set up in that exact moment. There was not setting it up on the plane or when I got to the hotel. I had to get it done in the moment. And now I am missing out on another experience. This hurts. I set everything up. I planned out my whole trip and life. And poof. It all falls away. Every time I try to plan out my life sequentially, the building crumbles and I am left standing with my pants down and dick out in the place where the bathroom used to be. Oh well is my thought. This is the way of the world. If life was easy, it wouldn't be fun. I already have a job."
vascillation,2017-08-26 15:53:00,"I'm here again. Where is that exactly? To game or not to game. Let's display that ground that we are on so that we can move forward with the discussion. I see girls. I like the way some of them look. They have pretty faces, boobs, and nice butts. They have eyes that can catch your attention from 20 feet away. In a past year, I would have said something. Now, I will not. I don't want to. I no longer feel the need to work for this shit. I don't want it bad. I don't want it at all to some extent. I started my job at HQ (previously Lux and before that, Karma, the first club I ever entered with Jimmy Nutts) a couple days ago. It is a place that allows 18+ clientele. God. I don't know what is wrong with me. I am simultaneously repulsed and attracted to these half naked 18-year-olds gyrating to trash music. I attracted for obvious reasons. The repulsion is newer. I think is coming from my newer want for something more real than the fuckboy lifestyle I've been on. Seeing these otherwise pretty girls give it up for trash guys to trash music saddens me and reveals the true futility of trying to find a serious girl in this atmosphere. Asexuality is the way to go. I am going to talk to Seth more about his lifestyle today because I'm genuinely interested in adopting it during my professional career and onward. This girl thing can only hurt me. The pleasure? A few minutes of good pussy. Good pussy. That is also the thing that I am repulsed by. I hate that I like these girls just because of their bodies. They have absolutely NOTHING to give me other than pussy and yet here I am again and again, fretting about whether one of them is going to respond to my message or meet me out for adate. They aren't worth the shoes that their dad's bought them and still, I'm feeling this way. For once, I'd like the opportunity to like a girl for her merit. Obviously, not solely on merit, but you under stand my point. Lastly, I see a danger. I see the powderkeg that every college campus is sitting on, and WVU is no different. We have a far left and a gender studies department same as everyone else. We have a significant black population just like everyone else. Every one of these girls needs to get blackout drunk to fuck a guy in these clubs. And they do. And they literally stumble home in the arms of some guy. This college exists in the gray area of rape every night and everyone knows it and still plays. The short term pleasure of pussy outweighs the potential life-ending consequences. Aside #1: the reason more people don't go to HQ is because it is branded as a black club. Ask everyone in town who the clientele of the place is and they will say niggas. And anyplace that has more than say ~4 niggas at a time, and I do mean nigga not black, does not succeed. There is an implicit threat of violence that could erupt at any moment since niggas are sensitive. Whatever man. I'm tired of vacillating between the extremes of doing zero game and diving all the way in. Fuck this."
becoming a person. I don't like these people too,2016-09-16 14:43:00,"I don't like people. And I say this in reference to: feminists (of any kind) - I dislike you because the activism of feminism is ""fuck men"" and you using this label for any reason supports that regardless of your justification. #blacklivesmatter - Lets be real. Unless you actually know the person who was killed or maimed or affected, you don't really give a fuck about that person's life (unless its a child or a woman). Black lives don't matter to anyone. White lives don't matter to anyone. But especially black lives don't matter to black people. police violence is negligible. also most of it is justified. I am very pro the murder of degenerate blacks. same with degenerates of all races. but honestly especially for blacks. child men (white knights) - grown men who can't go get what they want. grown men who don't have friends and don't have the capability to talk to a random person and enter a conversation to get a different perspective without getting offended. anti-gun mutherfuckers - none of these motherfuckers actually know anything about guns. these guys just look a gun and say, ""oh that shit looks scary. make it illegal."" Shit is more complicated than just making shit illegal. most women - most women can't think for themselves, are overcome by their biology and their emotions. i love generalizing. I like women who are like men. But I am not gay. So fuck you and don't try to convince me to go towards your degeneracy caused by your childhood sexual trauma (that is a message to gays who want me to be gay) I am confident that I can identify traits of these types of people listed above in the first 30 minutes of interaction with people. Everyone should have the ability to jude quality of character and read body language. Which brings me to my last group: I dislike people who make faces at my judgments of character and my accurate readings of situations. Still becoming a person but I am more a person than any of these other kids. Even these grown folk don't have original thoughts. Not that my thoughts are all original but they can't critically think about information they just default to what their tribe decides is correct. BUT I am still becoming a person."
what's the expectation,2024-12-30 11:11:00,"guess what i'm talking about hahaclaudiahasn't responded and i know she's landed becaused i checkd the flight. she landed at like 1am maybe and it's 6pm dec 30. now, i know how this looks. why the fuck do i know when her plane landed. well i looked it up. i needed to know if she was making another decision to ignore my message. now ot be reasonable and fair, what's the expectation? honestly, the way that these women are experiencing me, ti seems like i'm basically a chatbot... like anytime you send a message, BOOM, i'm there and i'm making jokes and answering. i'm freely available. always. now the game would be to play like i'm not available. don't really want ot play so much. BUt i can't be freely available. i truly shouldnt' be responding as quickly and as frequently.in my head though, i charish these small moments. i feel like my life is filled with lack and in this small period of time, someone cares about me. dramatic i konw. now why don't i give a fuck when anyone else messages me? dunno. probably because now, she's pushed me into a scaricy mindset.. well lets say, i've pushed myself into this mindset.i like the pain. i really do. oh god feeling things is horrible but at least you feel.at least you feel. still, i'll have to set boundaries on my time if i want to keep that girl. it's probably skating on fuckin zero if not already dead but hey, until the fucking fat lady sings man. i can't believe i'm this guy. chasing. wanting. desiring. how drole (don't konw what that word means)but hey, with all this, i might be back. making decent enough progress on the app. lets see"
microexpressions: this bitch,2014-12-02 00:47:00,"Admittedly, today I look awful. I'm dressed as a slob. I full well admit I do not look my best. I call myself out on it because sometimes I get self conscious about what others are thinking. Getting that out in the open makes me feel comfortable that they are not talking behind my back about it. but his bitch today. I was on my way to class but I stuck close to Nathan because I saw some cute girls walking toward him and I wanted to interact with them, or at the very least get a closer look. the girl that I knew in the group, casually picks my jacket and says in a non-sarcastic tone, ""Nice Jacket."" Clearly it was not a nice jacket. It is the ugliest one I own. but because of the whether and because I don't give a fuck, I don't give a fuck what people think. Or at least that is my ultimate goal as a human. I don't think I will ever be able to completely remove that need from my psyche but I can at least significantly decrease it. Anyway, I call my self out as always. then this whore continues to complement Nathan on everything he is wearing and then pauses as she is turning to me. I call myself out again, laughing in nervousness. Then, I see it. Telltale disgust all over her face. I don't know if I would have noticed if not for my fleeting education on micro expressions but there it was. Plain as day. As I walked away I couldn't help but think why the disgust and what gives her the right? This whore opens up her legs to untold amounts of guys in and out of every weekend. This whore is in some bullshit major, probably communications. This whore will ultimately end up in some ditch (I mean this figuratively of course) in her life. Haha I can just see it now. I can just see all these girls like this that think they are higher than me now, crawling back in 5, 10, or 20 years. Ugly looking roast beef vaginas trying their little bullshit tricks in order to get me to become the provider of however many children are produced by said roast beef. I can't wait to laugh in their faces as I block them on my phone or laugh in their faces in the aisle the local Kroger or Walmart and then walk away to my better life filled with purpose, wisdom, money, happiness, and a constant pursuit of knowledge. I hope they choose me as their rejector. But if not this experience has helped reveal several parts about being me that were hidden. I like to say that I don't care what people think but it still sometimes irks me when I see people visibly judging me negatively. Now, at least, I have some vision for my future, however vague. Time to study. Chibuzor Ejimofor* *Still becoming a person *Lost man in a woman's world"
Chelsea,2015-01-26 03:42:00,"For the longest time, I wondered why the only girl I took on a date in 2014 stopped responding to my texts. I did everything right. My spontaneous approach to her on the street was fun for both and I believe that is what attracted her to me. I was 100% not the most attractive man that she was speaking to but she still chose me for some reason, albeit for only about a week. Did I really like her? I would say no but at the same time, I was so focused on sex and her ass and so on that my judgment and actions were skewed. I didn't take the time to enjoy her for her and instead I enjoyed the fact that I had finally gotten a girl that I perceived to be out of my league and focused on 'closing the deal' so I could be proud of at least 1 thing on my sexual record. After the second date, when I took her home and we were making out on the bed, I kept going for the button on her pants. I kept going and kept going regardless of the fact that I had gotten denied several times. She was the best kisser that I have ever experienced but instead of enjoying this, I just kept going for the inside of her pants. I had not earned the inside of her pants. This was a very strong girl, at least in my experience. For lesser girls, this would probably have worked and has in the past. The terrible effect that my interactions with women and people has created in me is not respecting some of these girls enough to take a second and appreciate who they are as people and what they can offer me in ways other than their vaginas. I spent way more social capital than I had and that is the reason she dropped me. I was good and I treated her correctly but, in the end, she could see that all I wanted from her was the inside of her panties. And that's bullshit. Not her bullshit. My bullshit. It's bullshit that I wasted her time and my time by not living in the moment and enjoying the experience of interacting with a beautiful and strong woman. My eyes were opened while watching a RSD video on Intent. Now, I'm looking at all of the relationships that I currently have with women. THEY ARE ALL RUINED. All I do is grab their asses and sexualize shit whenever possible. Whatever social capital I have built up by having awesome parties and being cool, I have spent and over drafted the fuck out of all these relationships. Although I hate the word 'creepy', I can now see and interpret what the word may mean in order to improve myself and my future relationships. For me, if someone calls me creepy, it simply means that they do not like me. The word is more annoying than hurtful at this point, since I automatically discount any criticism anyone has against me if they can not even slightly expound or support their criticisms. There will always be girls in the world that will meet me and call me that word. I've made my peace with that. Now, I've decided that although unfounded names are unfounded, the name caller may just be very ignorant on argument, have no interest in philosophy or the search for truth. There still might be some infinitesimal legitimacy to any given claim. If I come across any evidence myself that may support their theories, then clearly I have some work to do. In this situation, this insight has given me an even better definition for the word. Being 'creepy' could be another way of saying that I have overspent my social capital with a given female or group of females. In the future, I will try to enjoy the girls and people that I am choosing to possibly be in my life. I want thoughts, virtues, or intelligences that add to my life in some way. Most people have some quality that I may be able to enjoy. This realization is nice since I already know for the most part what qualities that I am 100% incompatible with. Okay Bye."
29 - Permenant Celibacy aka 23 dates,2017-06-28 22:53:00,"I am done. This is an aside. I will be writing a quick post on life. I refuse to have sex with girls anymore. I will be celibate for real this time. last night, I made an exception and went back to a girl's place after my work job in Burlington. She was not attractive. She was a 1st grade teacher. She was kinda fat. She texted me while I was working and said that I could come over after I finished at the job. So. I went back to the girl's place. She was a terrible kisser. Kissing me like a rabid dog. If you gave food to a starving African that would be how she was nibbling at my face. Disgusting. She sucked my dick. Terrible as well. I've said it before and I'll say it again, I don't care much for blowjobs. She was also bad at them since she only stayed around the head. Anyway. Now the evil part of the story. I started having sex with her and as normal, I was going to cum too soon. So I pulled out had turned her over. When I started to fuck her from behind I noticed something. Blood. Blood on my condom-enclosed dick. More and more blood. I thought it was a little bit at first. Then it was a lot. I don't think I've ever been more disgusted with anyone or thing in my life. I stopped and lightly exclaimed, ""Wait, are you on your period?"" I knew the answer. She responded, ""Oops, I should have told you Chi."" Well, damn. I asked where the bathroom was and carefully removed the blood soaked condom so that none of the blood touched my skin. I didn't make it. There were a couple spots that made it onto my skin. I dabbed the skin first with a napkin to remove most of the fluid then soaped my dick down. I was scared as fuck. That was the first time my rational mind was fully awake and present during a sexual activity. Fight or flight mode had been activated. I wasn't angry though. It was my fault. I chose to go home with her against my better judgement. I chose to break my vow of celibacy and my standard for sexual activity and kisses. And I suffered the consequences. In situations like this, I usually try to separate on a pseudo-positive not and talk the person's ear off while I carefully remove myself from the situation. I don't explode with anger unless my ego is cornered and disrespect is throwing the fight or flight flag way up and cutting off all of the exits. I removed myself. I was mostly in shock after. It was as if this was a sign from the universe or a god or something. The second I go back on something that I decided to do for my own betterment, I was punished. My age. 23 dates. A girl has to make it on 23 dates with me before she can see my penis. She has to last to a second date to get a kiss. This is final. Sex is not important to me. It brings me no pleasure. I'm done here. What makes me feel good are my hobbies and my relationships. Sex is not important and it can wait. Masterbate once per week. Live life. That is all."
