title,published_date,content
,2018-12-03 23:29:00,"Let's go back to the time where you hug me so tight Back to the time when it all felt so right back to the time where it didn't have to go bakc to the time we were laying in the snow home from the world home from school playing hookey and being so cool and I wish we could go back to the time back to the days that you were mine. I miss your eyes and the way that you hum I miss your face and the way that you (gather slow?) I miss you I miss you I miss you x3 and I don't know what to do I miss you I miss you I miss you x 3 and I know that I shouldn't I miss you Every time I'm in love it's not hard to get hard get girls when I'm in this club it's not hard to get a number or a kiss its not hard to get a girl to come all the way home It's not hard but your the one I miss. It's not hard to play this guitar at home It's not hard to sit here all alone Except when it comes to Saturday night and I wish we could be back in fight (?) I don't know what I did to push you away I really thought that I put myself out there I really liked your face and your funny smile You're the first person to make me laugh in awhile Why don't you come back to me Why don't you come back oooaaaoooo Why don't you come back to me I wanna see you all the time Why don't you come back to me Why don't you come back now Why don't you come back and see me I don't know I haven't seen you in awhile What did I do to drive you away Seems like the last time we talked it all was okay I said what did I do to drive you away I just want you one more day Please let me back x3 Into your heart I said Please let me back x3 into your heart I tried explaining my feelings but I've only done it one time I said I tried to explain my feelings but I've only done it this time It's me I'm normally the villain but you with you I thought I was healing but now I'm back in the club getting phone numbers and not texting back girl please I want to be good I want to be fair I don't want to be hood I want to be nice I want to be respectful but you, you make me want to be neglectful I was a nice boy I was a nice boy before I met you I was a nice boy before I met her I was a nice boy until you said I shouldn't be now I'm the villain and it's plain to see I don't want to be this guy but i have to be I don't want to be this man a little mean I don't want to be this guy but the world says I must I don't want to be this guy but I want to fuck I gotta be a mean old bastard I gotta be a mean old dick I gotta be a mean old bastard I gotta be a mean old dick I gotta be, I gotta be a mean old guy and I don't want to hey when I walked in the room, you were seated at a desk at a nature reserve and you were sitting on the left I looked over and asked yo ufor a fact tell me about owls and teach me I said teach me and she said owls have lopsided ears one to hear a up high and one to hear the cheers of the owls all around us and owls do a lot of little things and they don't get sick and everytime I passed by, I made sure to catch your eye There was something about you, you feel so good so I picked up the ---- tray and I passed apps like I passed apps so fast like you were going away and I made my way across the room just to see you just to see you so I smile real big and I walk around the room and I talk up a storm I was a nice boy every day frustrated misunderstanding girls so I was never getting dated I did what they told me flowers and and a kiss on the cheek Pay for dinner and then let her go to sleep Rinse and repeat rinse and repeat Well sir it didn't fucking work and I'm stuck with my dick in my hands while she's got other plans that involve some other mans I just wanted that simple country boy life sit on the truck by the fire under the starlight bith my true love in america while an obligatorily old country artist like george strait or keith urban plays lulling us to sleep while in a small town something something 7th grade. It was all lies, and now I have to be someone else I used to be a nice boy docile and tame but there wasn't enough excitement to keep me on your brain then I learned *music stops* nice boys finish last and this all is a game *cue music/riff/drop so I became an asshole so I could get laid all the time I don't text back, leave these red bottom hoes on read i don't stay to chat on beds, jsut one night then I go on the pathway to hell because my dick was getting cold Devil on my shoulder saying"
planning,2018-05-10 16:48:00,"What do I want to do. I have put a lot of content into my dayone diary so apologies for the lack of content. posterity will be hard with my content spread across three platforms like this (iphone notes, blogger, dayone) but someday I will consolidate everything. I want to meet girls. I want to learn Russian. I want to gain motivation to learn Russian. I want to make new friends. I am nervous and scared though. Why? I am scared of taking action. I'm scared of the inevitable failure. I'm scared of trying these new things, going to countries with completely different languages and cultures. I'm definitely uneasy. It is a weird feeling. It is a feeling where the future, the next actions that I should take are truly unknown. I do not know what I should do, what I should focus on, whether I should vlog of make videos about my experiences. I just don't know. There is no wat to alleviate that. There is only to swim into life with open eyes and open arms. I hope that I will recieve my signing bonus withing the next week. This in itself would radically change my outlook on the trip. I would be able to stay comfortable in Moscow for 1-2 weekends and then comfortably leave saint petersburg knowing I left without much on the line. I know the extent to which I need to be approaching. I have subconscously been ruling certain contexts out... mohter daughter, fauther-daughter, groups, public, airports, grocery stores, from car, in the street etc. and these were the places where I thrived as a young one. I've been saying I need ot get back to the freedom I felt for those last few months of Baltimore. That neive feeling where the world was mine and nothing could touch me. The Kanye level of confidence where for someone ot not want to be with me says more about them than me. The internalizing of all game concepts into this beautiful caucofany of action and game and will and beauty."
vascillation pt 2,2017-08-26 22:39:00,"Also, watching game of thrones and reading the Course of Love book are making me long for an arranged marriage. The same battles exist regardless and the success or failure of the marriage solely depends on your willingness to negotiate and stay in the relationship. Beauty is wonderful and is necessary for the next 40 years but after, that shit is gone. What does this mean for my game? I've long suspected this. Theoretically, I am and can be compatible with everyone on the earth. After a tiny bit of game, you realize that every girl is game. Every girl can be wooed. It has nothing to do with personality specifics, career, money or even words. This shit is body language. This non-revelation means nothing though. I will continue to look for the girl that I found in Daria. I'll keep looking for the girl I found described 2 posts ago (from Boston). I have something in mind that would make my eternal commitment easier than not. The only way to find out if a girl qualifies is to speak."
47 - married woman,2018-12-12 00:05:00,"I told myself and other people that I wouldn't do it but I did. I went back and did it. I cucked this poor man. How do I feel? there is a kind of powerful feeling that comes from cucking this powerful ass dude. Even through the prize wasn't that great, it was about closing the loop. It was extremely dangerous and degenerate of my but that is almost what is needed now to get me out of the proverbial bed. The pussy was deep. I didn't like eating her out because of the floppiness of the lips and the general look. I do not like eating pussy that has a taste. Fucking disgusting. I know how to do it but goddamn I don't like it. I also found a new thing where my dick doesn't stay hard the whole time. If I really start getting affected or disgusted mentally, the dick does not stay hard. This is an interesting development. This might force me to be better in what I'm choosing as a partner. I'm close to hitting 50. I want to hit 50 before the end of the year. This is very doable though it might get hard. technically we have less than 20 days to complete the mission. I accept the burden along with the creation and nurturing of the ideas that I plan on publicly putting out there on the internet. Driving traffic to the blog is one of the things that will be fun to do but further finding ways to generate revenue from this new platform. I think separate websites for hoetry and travel are going to be the move. Once procure the affiliate tools from the 3 websites, kiwi, aribnb and hostel world, I will be off to the races. I also know that no one reads anymore so driving people to this website will be partly illusory. I will have to supplement the reading content with vlog type videos. good luck chi. You are an evil person and that is fine. That term holds no power over you anymore. That moral center that you have been fighting to hold onto despite there being no evidence to keep it is gone. I think there are things that I will maintain as far as behaviors go but the ban has been lifted. I don't know why I went and fucked that old bish even withe the potential danger of the situation. I did it because I fucking could. I have been giving into my vices regularly as of late. I like the idea of rewarding myself with positive things like going to the gym. And I think I will start that today."
94 - ole russian girl,2021-07-19 07:13:00,met a random old 50+ year old russian woman who i banged out. she was on her period. we met when i was supposed to hang out with another girl but i went ahead and banged her instead.
i failed jack again - should i be a teacher,2019-06-10 06:50:00,"I feel that I understand these concepts that I'm putting out into the world and then almost immediately I'm confronted with the reality of the world in that the simple kindergarten concept that I am trying to logically explain through words and actions is actually so far from a normal person's reality that it isn't recognized by their mind. It literally isn't coming through at any level. And that is the most frustrating thing on the planet earth for me and for that person. W are both communicating but on different wavelengths. I understand why RSDTyler doesn't coach the noobs anymore. It isn't possible for someone that is semi-enlightened and present to the world around them to identify with the way that someone is feeling outside of that state. The response is, ""dude just do this, then this, then this, then this, and then you will be in the mood to socialize."" but when step one isn't doable, is there any room for improvement. Can you even meaningfully engage in the conversation of the situation? no. The answer is no. And if Jack was anyone else tonight, I would have left him in the dust. I have no patience for bad energy and I paid homage to the years-long respect and friendship that we have by sitting with him tonight and having that conversation and interaction. For some fucking reason, he couldn't get out of a negative headspace. He was so deep that even when a girl that he worked with walked by, recognized the situation and started hugging and kissing him in the street to make him feel better, he still ended up angry at me... when that happens. I don't fucking know what to do. I can't do anything. I don't know what to do to change this mane or make him act differently. And the fact of the matter is, there is nothing that could have done to make him ac different. We are all on our own path. Once you explained yourself once, further bullshitting and repeating the same story isn't going to add new information or change anyone's lives. fuck off. [letter to my mans that he will never see] You can be extremely entertaining and funny when you are doing your standup and interactions in the right context. In the right places, the shit that you are doing is magical and the next level. the connection that you can generate from your openness to people is astounding and enviable. When it is not working though, it is a trainwreck. [Sunday] I introduced you to a couple people that I have been friends with for a long time. We start having conversations that are open to general input from anyone that is sitting new by or who wants to participate. I understand the feeling of being outside of a group and looking for a place to contribute and add value. You did not succeed here in this try, which is fine, but I think it is important that you learn from this. No one is mad at you or thinks less of you. We have all been there and we know where your head is at and where you are coming from with your slightly too loud, slightly belligerent, frenetic, awkward energy. It's okay. Your stories here did not add value... they were attempts to connect with people who don't know you and thus don't care about the story that you are going to tell. I don't know how to describe it... but I will try. If you have value in their eyes, they will want to hear the story that you are going to tell. There is not much of a difference between a story that you will tell versus a story that Joe Rogan would tell as far as the content goes. The main difference is the context where Joe Rogan has the value and respect in the eyes of the people around him. That value and respect can be generated through fame, demeanour, tone, body language and through the content of the discussion that you are having with people. Generally, though, my opinion is that you have to build up more social capital to just be telling people stories about your life... You have to be an extremely funny person that has mastered storytelling and knows the highs and lows and knows how to hit the punch line of the story and how to finish it off at the end. If you don't have the social capital, you end up telling the story to .a lot of people who have blank faces and who want to interrupt with something to drive you off of the path and get on to something more fun that they can engage with. I and others notice these social cues to shut the fuck up about that boring ass story and more on to something that we can also have fun with. The other thing is in your delivery. I will complete this later."
idk what to talk about but I want to post so...,2016-11-03 08:07:00,"Hi This is probably the first post that I am making not under duress. I am not falling apart. I ma merely making a commentary on my life. Again, I am trying to maintain my existence outside of my comfort zone. Although, is there any space for not wanting to do something? For example, if I am heading home after work one day and I don't feel like talking to girls at Furman or Clemson, is it good for me to force the drive and the interactions? Or should I chill? I have been chilling but in the past, I would have seen this as unacceptable. I don't need to constantly game because I have the skillset to succeed already. I could always get better but it is draining to go out so often. Almost of the point where I start to dislike women. I find that I function the best if I gear up for an hour or two before I go out with the proper mentality. I personally need to make myself some motivational videos so that I can be relying on things that I already know and not external persons (namely RSD). I have done a decent job of balancing out my life but there are days when I will just look around and observe and feel fine as an introvert. Zero interactions in that daytime with anyone but myself. That is healing for me. It is good to have time to myself where I completely let go of any intent to approach anyone on the street. I get to just look around and observe life. This would be the perfect mentality to have when daygaming but that might taint that pure expression of life. Best to keep this separate at least for now. Is there anything else? yes, I am awesome. I have the ability to make a girl fall for me somehow. I did it this weekend in Columbus. I think it was a combination of my honesty and looks. I have mastered conversation to say what I need to say without revealing my political positions. That is the only thing that separates me from 99% of the females that I meet while I'm out. The default position of polite society is 'fuck trump', 'fuck republicans', and 'everything is racist and sexist'. This is trivial to navigate but it does suck that I can't fully express that part of myself. Should a difference in political opinion prevent me from having sex with a girl? Theoretically, yes. At this current stage in my life though, I feel like I would lose out on a lot fun experiences by setting that boundary. I do need some additional standards, specifically when it comes to attraction. I say this because I have settled for some evil acts in the past when I have the ability to do great things. I don't settle for less in my professional life because I don't have to. I need to create that framework in my personal life. There were a couple things that Shelby said that I percieve as red flags. Namely, after expressing that she was a bisexual and I said we should have threesomes, she said,""My sexuality isn't a prize for men to get and be excited with."" There is nothing wrong with that statement but it is indicative of a deeper social justice warriory attitude that is toxic for society and has the ability to destroy me should I get on its bad side. She also mentioned that she was a part of the LGBTQ community and pretty much everyone that claims that shit is a degenerate whom I have not business having any dealings with. The thing was she was attractive and had a big butt. Haha. That is pretty much it. I held most of the jokes. I don't even remember what I said. All I know is that I was saying a lot and doing minimal. I definitely framed myself as a keeper more than a one time or multiple time fun thing. I'm not sure how to frame the latter. I see myself as perhaps too scared to scare off the girl with bluntness or honesty of what I really want from them: sex. I am trying to become more of a person so I think that this may be fine but any fear associated with expressing an honest interest for only sex or an actual relationship would be good to start. :) Still becoming a person. AY roll credits."
be better,2017-09-20 21:34:00,"I met a man the other day. He is beautiful and a junior in industrial engineering. He talked to the same companies that I talked to and received job offers on the spite despite his lack of being the correct age or level in school. I did not receive those things. I need to be better. I have pain that comes from cold approaching. I was decent at it and that was part of what made me who I am. I know i have talked about getting back to my roots but this is a moment where it is starting to affect my life. I am not as good as used to be. I have gotten comfortable in my nonsense. I have gotten comfortable not being the best. I know that I do not deserve to be in the position to get an interview for this GE chemical engineering job. I know I am not good enough to get into a non-safety rotational engineering program. My work ethic is trash and I do thing that people can see through shit when it is shit. I am masquerading as Chi. I need to go soul search and create a-new the man who I need to be. This does not mean looking back at history at how things used to be done. This is about remaining present and making myself better than I ever was. Resume doesn't means shit if you can't walk up and charm the pants off of someone. I need to be better. I need to be sexy. I need to be comfortable with all parts of the human interaction. Beginning e.g. the opener, the middle e.g. building rapport, and the end e.g. the close/pull. Get better for you and get better for those around you. There has been a trend where you just talk about all this shit. You just talk about the old days. You just talk about the way things used to be. You just brag about your current level of non-success. Do not be proud of your lack of success. Do not parade it around as a badge of honor. With the amount of years that you have been participating in game, you should have already achieved that different level of success. 6 girls a semester is trash. Out of the amount of pull-ups that you have partaken in, this number should be near 20 or 30. Hello, my name is Chi. I will be better."
